0	 Identified Illness as a learning need, Identified Injury as a learning need, Identified Follow-up care as a learning need, Patients primary language is English, No Barriers to learning were identified, No interventions were used to address Barriers to Learning, Teaching methods used included Printed Patient Instructions, Verbal Instructions, Patient verbalized an understanding of discharge teaching.
0	The patient will continue in the Outpatient Addiction Program including 60 minutes of psychoeducational group therapy and 90 minutes of process group therapy daily for approximately 3 weeks.
0	 Patient seen and discussed with supervising consultant, Dr. N , who saw and evaluated the patient and concurs with the assessment and plan.
1	pantoprazole [PROTONIX] 40 mg tablet enteric coated 1 tablet by mouth Bid before meals.
0	Patient is in agreement with plan of care.
0	 Therapy Goals:   Patient will be instructed in home program, demonstrate understanding, and state ability to continue independently.
0	 Discussed the risks, benefits, and alternatives of the procedure and advance directives and the necessity of other members of the healthcare team participating in the procedure.
0	She will return to see us should she have any persistent symptoms despite the above interventions.
0	 No: new confusion or inability to stay alert and awake; newly stiff or painful neck; purple or red rash/blotches that stay when pressed by a glass (purpural rash); severe headache; sensitivity to bright light or currently feeling like he is going to collapse every time he stands (sits)
0	 Discussed the risks, benefits, alternatives, advanced directives, and the necessity of other members of the healthcare team participating in the procedure.
0	 His questions were answered, and he verbalized understanding of these instructions and agreement with this plan.
1	metoprolol tartrate [LOPRESSOR] 25 mg tablet 1 tablet by mouth two times a day.
0	 Explained diagnosis and treatment plan; patient/child/caretaker expressed understanding of the content..
0	 Persistent or regularly recurring symptoms such as painful urination, urgency or urinating more frequently
0	 Identified Injury as a learning need, No Barriers to learning were identified, Teaching methods used included Printed Patient Instructions, Verbal Instructions, Patient verbalized an understanding of discharge teaching.
0	 Family at bedside, Call light within reach, Hospital ID band on, Patient safety, dignity, sense of well being and individual rights are respected.
1	Patanol 0.1 % drops 1-2 drops ophthalmic two times a day as needed.
0	 After discussion of the risks, benefits, and alternatives to treatment with cryotherapy, informed consent was obtained.
0	The patient understands the information and questions answered; the patient wishes to proceed with the biopsy.
0	 PROVIDED pt  with my name and my secretary's phone number as a means of reaching me with any questions or concerns regarding nutrition.
0	 Client was instructed in the principles of posture and body mechanics as related to work tasks, home, and leisure activities.
0	The patient denies areas that bleed or cause pain.
0	 Patient's  anxiolysis discharge level  based on the following parameters: Alert, oriented, and stabile cardio/respiratory status - yes.
0	 Patient identified using two identifiers and permission was obtained to perform a fingerstick INR.
0	 Discussed the risks, benefits, and alternatives of the procedure and of possible blood transfusion.
0	 Patient arrives, via stretcher, History obtained from patient, Patient appears, in distress due to pain, Patient cooperative, alert, Oriented to person, place and time.
0	 Patient arrives ambulatory, Gait steady, History obtained from patient, Patient appears comfortable, Patient cooperative, alert, Skin warm.
0	 Little or no improvement after following the provider's instructions; Persistent or regularly recurring symptoms such as painful urination, urgency or urinating more frequently
0	No: currently inconsolable crying; vomiting; diarrhea; not feeding normally; poor weight gain or jaundice
0	 Patient discharged to home, carried, family driving, accompanied by parent, Discharge instructions given to father.
1	Maxalt 10 mg tablet 1 tablet by mouth as directed by prescriber as needed.
1	There, the pain was initially controlled with IV analgesics or nerve blockade.
0	The client verbalized understanding and consented to the plan of care and the goals established.
1	lisinopril [PRINIVIL/ZESTRIL] 30 mg tablet 1 tablet by mouth one time daily.
1	metoprolol succinate [TOPROL XL] 100 mg tablet sustained release 24 hour 1 tablet by mouth one time daily.
0	 Please see discharge summary of this date for recapitulation of hospital course, discharge diagnosis, follow-up, and recommendations.
0	 Assessment of Impairment, Severity/Complexity of Illness: The degree of impairment is exemplified by negative influence from living with chronic pain.
0	 Patient arrives ambulatory, Gait steady, History obtained from patient, Patient appears, anxious, restless, uncomfortable, Patient cooperative, alert, Oriented to person, place and time.
0	Patient was instructed to be fasting for a minimum of eight hours and to arrive with a driver for the radiofrequency ablation procedure.
0	 Client was provided with verbal and written (  Weekend Planning,   &  ) instructions.
0	 The patient asked appropriate questions, verbalized understanding of materials covered and expressed a willingness to comply.
0	 No: extremely dry mouth; dizzy when sitting or standing; new wheezing or severe or persistent vomiting
0	I personally spent over half of a total 15 minutes face to face with the patient in counseling and discussion and/or coordination of care as described above.
1	Ipratropium-Albuterol [COMBIVENT] 18-103 mcg/Actuation Aerosol 2 puffs by inhalation four times a day.
0	 With the assistance of a Spanish interpreter, ready to learn, no apparent learning barriers were identified; learning preferences include listening.
0	 Ready to learn, no apparent learning barriers were identified although she notes her concentration is off; learning preferences include listening, reading, seeing, and doing.
0	Nursing assessment:  Patient's provider will be contacted for additional advice and follow-up will take place with the caller.
0	 Following denial of allergy and review of potential side effects and complications (including but not necessarily limited to infection, allergic reaction, local tissue breakdown, systemic effects of corticosteroids, elevation of blood glucose, injury to soft tissue and/or nerves and seizure), the patient indicated they understood and agreed to proceed.
0	 In review of the client's progress, it has been determined that the client has obtained the maximum benefit from Occupational Therapy services.
1	Vitamin B-12 100 mcg tablet 1 tablet by mouth one time daily.
0	The patient was transferred to the Title
0	 He will return to see us should he have any persistent symptoms despite the above interventions.
0	 No: description of diarrhea: blood, pus or mucus mixed with loose stools or description of diarrhea: pale, greasy or oily loose stools
0	 I have carefully reviewed the significance of each laboratory studies with the patient in great detail.
0	There is no rebound, no guarding and negative Murphy's sign.
0	 Risks, benefits, alternatives of procedure and necessity of other healthcare team members involved in procedure were discussed.
0	 Patient Education:  Ready to learn, no apparently learning barriers were identified; learning preferences include listening.
0	There is no evidence of irritation or break in the skin.
0	 Complex assessment performed, Patient arrives ambulatory, Gait steady, History obtained from patient, Patient appears, anxious, in distress due to pain, Patient cooperative, alert, Oriented to person, place and time.
0	 With the assistance of a Somali interpreter, ready to learn, no apparent learning barriers were identified; learning preferences include listening.
1	lisinopril-HCTZ 20-12.5 mg tablet 1 tablet by mouth one time daily.
0	 Patient/Family Education:  Ready to learn; no apparent learning barriers were identified; learning preferences include listening.
1	Albuterol [PROVENTIL/VENTOLIN] 90 mcg/Act HFA Aerosol 2 puffs by inhalation every 6 hours as needed.
0	Patient offers verbalizations that indicate emotional and cognitive understanding of problems related to alcohol and other drug use and describes needed behavior change.
0	 Dimension 5 Relapse, Continued Use or Continued Problem Potential : The patient continues to demonstrate a problem, or has developed a new problem, that requires coping skills and strategies to prevent relapse, continued use or continued problems.
1	 Pulmicort Flexhaler 180 mcg/actuation Inhaler 5 puffs by inhalation two times a day as needed.
0	 The patient has had a combination of the following symptom for greater than 7 days: upper respiratory symptoms for 7 days, colored nasal discharge, maxillary or frontal pressure, facial pain worse with bending forward
0	 No: inability to stay alert and awake; severe lethargy or floppiness; current or recent seizure; high-pitched cry (like a cat's cry) OR a weak whimper or moaning cry that is not consolable; purple or red rash/blotches that stay when pressed by a glass (purpural rash); bulging or tense fontanel (soft spot on the head) when not crying; fever (rectal temperature)of more than 100.4
0	There is no lower extremity edema present bilaterally.
1	No: regular use of warfarin (coumadin) or regular use of heparin or low molecular weight heparin
0	The patient is a student and involved in sports.
0	 Patient requires extensive assistance in the following activities:  bathing, dressing, grooming/hygiene, toileting, transfer to/from bed/chair, mobility.
1	levothyroxine [LEVOTHROID] 125 mcg tablet 1 tablet by mouth one time daily.
0	 In addition to discussing the most common side effects, i.e.,nausea and sleep disturbances, I discussed with patient that some smokers who use varenicline  experience agitation, depressed mood or suicidal thoughts.
0	 Strep screen, treat per protocol, symptomatic relief discussed, Strep pharyngitis considered contagiousness until treated for 24 hours, Advised to recheck if not resolved in one week or sooner if worse in any way., Medications and side effects discussed.
0	 No: fever each day for more than three days or fever that has recurred after 24 hours without fever
0	 Explained diagnosis and treatment plan; patient and Mom expressed understanding of the content.
0	 Localized area of red, swollen, tender and warm skin that is expanding over period of couple hours
0	 Patient needs to schedule an appointment for a gynecology or preventive medical examination within the next 3 months.
0	 No: blue or dusky lips, skin or nail beds; struggling to breathe even while inactive or resting; shortness of breath; sudden onset of coughing, choking or gagging due to inhaling something into the airway; noisy, wheezy, croupy or raspy breathing that doesn't clear with coughing or apnea
0	The patient was contacted with the above information.
0	 Fetuses who have Down syndrome tend to have a thickening of the skin on the back of the neck, and therefore an increased nuchal translucency can indicate that the fetus has Down syndrome.
0	male who presents for evaluation of Knee Pain.
0	 The general care of a sprain includes the use of a medication to reduce pain, the use of a splint to reduce movement and Resting, Icing, Compressing and Elevating the injured area.
0	 I have discussed the case with him and am in agreement with his findings and interventions provided.
0	 Identified Illness as a learning need, Identified Procedures, tests, or preps as a learning need, Identified Follow-up care as a learning need, Patients primary language is English, No Barriers to learning were identified, No interventions were used to address Barriers to Learning, Teaching methods used included Printed Patient Instructions, Verbal Instructions, Patient demonstrated and verbalized an understanding of discharge teaching.
1	Synthroid 200 mcg tablet 1 tablet by mouth one time daily.
0	Thank you for choosing the Name, M.D.. care team for your health care needs!
0	 No: pain when passing urine; urinating more often than usual; cloudy or foul-smelling urine; blood in the urine; new daytime wetting; new bed-wetting; change in urine color or foamy or frothy urine
0	 Complex assessment performed, Patient arrives ambulatory, Gait steady, History obtained from patient, Patient appears, uncomfortable, Patient cooperative, alert, Oriented to person, place and time.
0	No: currently inconsolable crying; vomiting; diarrhea; not feeding normally; poor weight gain or jaundice
0	 Discussed risks, goals, alternatives, advance directives, and the necessity of other members of the healthcare team participating in the procedure with (patient) (legal representative and others present during the discussion).
0	I personally reviewed these images and agree with the radiology report and shared the findings with the patient.
0	 No, there is not a history or concern, or exposure to physical, emotional, sexual, financial abuse, neglect or domestic violence
0	No: struggling to breathe even while inactive or resting or new confusion or inability to stay alert and awake
0	 Explained diagnosis and treatment plan; patient/care giver expressed understanding of the content.
0	 No: new confusion or inability to stay alert and awake; newly stiff or painful neck; severe pain in one eye only; new blurred, dim or double vision; new weakness, numbness, or tingling on one half of the body (arm AND leg) ; new difficulty speaking or slurred speech; purple or red rash/blotches that stay when pressed by a glass (purpural rash); any chest pain or discomfort or new shortness of breath
1	omeprazole [PRILOSEC] 20 mg capsule enteric coated 1 capsule by mouth two times a day.
0	Thank you for choosing the Name, M.D.. care team for your health care needs!
0	 Patient discharged to home, ambulating without assistance, transported via taxi, unaccompanied, Discharge instructions given to patient, Above person(s) verbalized understanding of discharge instructions and follow-up care.
0	 Patient  is ready to learn, no apparent barriers to learning were identified:  Patient understands and agrees with plan.
0	 Patient requires extensive assistance in the following activities:  bathing, dressing, grooming/hygiene, toileting.
0	 Medication(s) were reviewed by discussing verbally with patient and/or caregiver, reviewed by checking medication bottles brought in by patient and/or caregiver.
1	Instructions: Take 2 tablets on first day followed 1 tablet daily on Days 2 through 5. Take medication for 5 days.
0	 Identified Illness as a learning need, Patients primary language is English, Other identified Barriers to Learning included, age, Involved Family Member or Primary Caregiver to address Barriers to Learning, Teaching methods used included Printed Patient Instructions, Verbal Instructions, Patient verbalized an understanding of discharge teaching.
1	Ipratropium-Albuterol [COMBIVENT] 18-103 mcg/Actuation Aerosol 2 puffs by inhalation four times a day.
0	 The majority of the time, the presence of an extra chromosome, depending on which chromosome number is involved, leads to an early miscarriage due to incompatibility with life.
0	Lungs: Clear to auscultation bilaterally, equal chest rise, on room air.
1	Paxil 40 mg tablet 1 tablet by mouth one time daily.
1	Time was spent discussing with the patient the neurobiology of nicotine addiction and the rationale for using medications to help with cessation.
0	Thank you for choosing the Name, APRN, C.N.P., M.S.. care team for your health care needs!
0	I have provided the rationale for my recommendations and the plan of management.
0	 Negative gastrointestinal review of systems, Historian denies abdominal pain, nausea, vomiting.
0	The portions of the nerves between and next to the vertebrae are the spinal nerve roots.
0	 No: foreign body in the eye; child appears sick or not well; outer eyelid or area around eye appears very red and warm; area around eye is swollen or eye is almost swollen shut; eye pain, not just irritation; eyes are sensitive to light; patient has an immune system problem or a new change in vision
0	 Identified Illness as a learning need, Patients primary language is English, No Barriers to learning were identified, Teaching methods used included Printed Patient Instructions, Verbal Instructions.
1	metoprolol tartrate [LOPRESSOR] 50 mg tablet 2 tablets by mouth two times a day.
1	Multiple Vitamin tablet 1 tablet by mouth one time daily.
0	Reviewed signs and symptoms of surgical site infection.
0	 Discussed with the patient the necessity of other members of the healthcare team, both male and female, participating in the procedure if needed.
1	aspirin [ECOTRIN] 325 mg tablet delayed release 1 tablet by mouth one time daily.
0	I attempted to answer any questions that she had regarding her headaches and the recommended treatment.
0	 F (38 C) or suspected fever; pain when passing urine; blood in the urine; urgent need to urinate; urinating more often than usual; cloudy or foul-smelling urine; vomiting or new changes in sensation associated with neck or back pain
0	We discussed that the patient should not share the medication with anyone else.
0	The information provided in the assessment is based on review of the medical record as well as the face to face interview with the Patient/Caregiver.
1	lisinopril-HCTZ 20-12.5 mg tablet 1 tablet by mouth one time daily.
1	Tylenol Extra Strength 500 mg tablet 2 tablets by mouth every 6 hours as needed.
0	 She understands and agrees with the plan of care, and she is discharged from the Emergency Department in stable condition.
0	Patient will verbalize and demonstrate understanding of home exercise program following this therapy session.
0	 Discussed risks, benefits, alternatives, advance directives, and the necessity of other members of the healthcare team participating in the procedure.
1	  dilTIAZem CD (CARDIZEM CD/CARTIA XT) 120 mg 24 hr capsule, Take 1 capsule (120 mg total) by mouth daily.
0	Patient understands that the warts are skin growths caused by a viral infection in the top layer of the skin.
0	 I explained the diagnosis and treatment plan in detail, and the patient clearly expressed understanding of the content reviewed.
0	 Knee:  The left knee joint was sterilely prepped in the usual fashion, and aseptic technique was utilized throughout the procedure.
1	nifedipine-Plastibase topically two times a day as needed +.
0	 The alternatives were also thoroughly discussed, as well as the advanced directives, and the patient was made aware that other members of the surgical team will participate in the procedure.
0	 Informed consent: Discussed risks, goals, alternatives, and the necessity of other members of the healthcare team participating in the procedure with the patient and obtained informed consent.
0	 Discussed the risks, benefits, alternatives, advance directives, and the necessity of other members of the healthcare team participating in the procedure.
0	 The patient has not experienced TIA symptoms, facial drooping, left leg/calf pain, right leg/calf pain, dyspnea, prolonged bleeding, blood in stool or urine, nose bleeds, easy bruising, changes in prescription medicines, changes in over-the-counter medicines, changes in diet/vitamin K intake, recent injury/fall(s), blood pressure elevations above 140/90.
0	 Peripheral IV site, established in the right wrist, using a 20 gauge catheter, in one attempt, Saline lock established.
0	 Patient Education:  Family ready to learn, no apparent learning barriers were identified; learning preferences include listening.
0	Patient/caregiver rates left great toe pain at 3/10.
0	Thank you for choosing the Name, M.D.. care team for your health care needs!
0	Lungs:  Good air entry bilaterally, no crackles, no wheeze.
0	 The general care of a sprain includes the use of a medication to reduce pain, the use of a splint to reduce movement and Resting, Icing, Compressing and Elevating the injured area.
1	Glucagon Emergency kit (human) 1 mg kit 1 MG intramuscular as directed by prescriber as needed.
0	 Patient arrives, via hospital wheelchair, Unsteady gait, Assistance to cart, History obtained from patient, Patient appears comfortable, Patient cooperative, alert, Oriented to person, place and time.
0	 Client will verbalize understanding of the cycle of pain to assist with decreasing pain behaviors after 1 treatment session.
0	 Patient arrives, via hospital wheelchair, Gait steady, History obtained from patient, Patient appears comfortable, Patient cooperative, alert, Oriented to person, place and time.
0	Patient is aware to call with additional questions or concerns.
0	 Ready to learn, no apparently learning barriers were identified; learning preferences including listening.
0	 I reviewed the interim history, examined the patient, and reviewed the available imaging studies.
0	 No: new confusion or inability to stay alert and awake; currently feeling like you are going to collapse every time you stand (sit) or sudden onset of inability to urinate
0	 Patient arrives ambulatory, Gait steady, History obtained from patient, Patient appears comfortable, Patient cooperative, alert, Skin warm.
0	Recheck if not resolved in one week or recheck if breathing or swallowing problems or worsening symptoms occur.
0	woman who presents today for a women's health consultation.
0	Neurological:  Positive for loss of balance or tendency to fall easily and weakness in arms or legs.
0	This patient education treatment modality addressed the ASAM Dimension 4: Readiness to Change criteria.
0	I reviewed her note and agree with the findings, assessment, and plan.
0	Patient tolerated the procedure well and there were no complications.
0	 Identified Illness as a learning need, Identified Follow-up care as a learning need, Patients primary language is English, No Barriers to learning were identified, Involved Family Member or Primary Caregiver to address Barriers to Learning, Teaching methods used included Printed Patient Instructions, Verbal Instructions, Patient verbalized an understanding of discharge teaching.
0	 Understanding of the program was verbalized, the patient/caregiver agreed to participate and was enrolled.
0	Patient Education:  Ready to learn; no apparent learning barriers were identified; learning preferences include listening.
0	I explained the diagnosis and treatment plan for the patient who expressed understanding of the content.
0	 As to what I taught today, the recipients showed readiness to learn, I identified no apparent learning barriers, and we established listening as a learning preference.
1	ibuprofen [ADVIL] 200 mg tablet 1-4 tablets by mouth every 6 hours as needed.
1	amoxicillin [AMOXIL] 500 mg capsule 1 capsule by mouth every 8 hours.
0	The plan of care was discussed with the patient who is in agreement.
0	 Dimension 3 Emotional, Behavioral or Cognitive Conditions and Complications: The patient received a Risk Score of 1. Interference with Addiction Recovery Emotional concerns related to negative consequences and effects of addiction; patient is able to view these as part of addiction and recovery.
1	cyanocobalamin 1,000 mcg tablet 1 tablet by mouth one time daily.
0	 Pain or pressure in cheeks or forehead over sinuses, or in the upper jaw, discolored nasal or postnasal discharge (yellow) and pain in the face or upper jaw that is worse on bending forward
0	 The treatment for this type of injury is the use of a splint to reduce the movement of the injured tendon.
0	 Identified Follow-up care as a learning need, Patients primary language is English, No Barriers to learning were identified, No interventions were used to address Barriers to Learning, Teaching methods used included Printed Patient Instructions, Verbal Instructions, Patient verbalized an understanding of discharge teaching.
0	 No: new shortness of breath; pain, pressure or tightness in the chest, jaw or arm or new confusion or inability to stay alert and awake
0	 Hand Therapy/ S/P repair of the left flexor digitorum profundus of the long, ring, and small fingers, and repair of the ulnar artery: zone V
0	Thank you for choosing the Name, P.A.-C., M.S.. care team for your health care needs!
0	 Discussed with the patient the necessity of other members of the healthcare team, both male and female, participating in the procedure if needed.
1	 Following this, the groin was prepared with a ChloraPrep scrub then reexamined using the same transducer, a sterile ultrasound transducer cover, and sterile ultrasound transducer gel.
0	 Neurologic:  Hand sensory change - no right and left; foot/stump sensory change - no right and left; painful - no right.
0	 Barriers assessed (Cultural, Religious/Spiritual, Motivational, Physical/Cognitive, Language, Emotional).
1	triamterene-HCTZ 37.5-25 mg tablet 1 tablet by mouth one time daily.
0	 GI: no dysphagia, abdominal pain, jaundice, nausea, vomiting, diarrhea, constipation, melena, hematochezia
0	 Patient arrives ambulatory, Gait steady, History obtained from patient, Patient appears, uncomfortable, Patient cooperative, alert, Oriented to person, place and time.
0	I explained the diagnosis and treatment plan for the patient who expressed understanding of the content.
0	No: new confusion or inability to stay alert and awake or currently feeling like you are going to collapse every time you stand or sit up
0	 Patient will verbalize understanding of the correlation between depression and chronic pain.
0	Genitourinary:  Negative for incontinence, pain with urination and pelvic pain.
1	 Disp : 150 ml - Suspension, Sig : Give 5 ml by mouth 3 times a day for 10 days, Refill : None.
