0	 No: new confusion or inability to stay alert and awake; newly stiff or painful neck; sudden onset, like a 'clap of thunder'; severe pain in one eye only; new blurred, dim or double vision; new one-sided weakness, numbness, or tingling; new difficulty speaking or slurred speech; purple or red rash/blotches that stay when pressed by a glass (purpural rash); any chest pain or discomfort or new shortness of breath
0	 No: new confusion or inability to stay alert and awake; pain or difficulty bending neck; purple or red rash/blotches that stay when pressed by a glass (purpural rash); severe headache; sensitivity to bright light; currently feeling like he is going to collapse every time he stands (sits) or current or recent seizure
0	Please do not hesitate to contact me with any further questions.
0	 Explained diagnosis and treatment plan; patient/child/caregiver expressed understanding of the content.#1
0	 Patient arrives ambulatory, Gait steady, History obtained from patient, and parent, Patient appears comfortable, Patient cooperative, alert, Oriented to person, place and time.
0	 Discussed goals, risks, alternatives, advanced directives, and the necessity of other members of the surgical team participating in the procedure with the patient.
0	 I explained the diagnosis and treatment plan, and the patient expressed understanding of the content.
0	 Adolescent Dimension 3: Emotional, Behavioral or Cognitive Conditions and Complications Intensity of Service/Level of Care
1	calcium-vit D3 600 mg(1,500mg) -400 unit tablet 1 tablet by mouth one time daily.
1	famotidine [PEPCID] 20 mg tablet 1 tablet by mouth two times a day.
0	 Discussed advance directives and the necessity of other members of the healthcare team, both male and female, participating in the procedure.
0	 Procedural pause conducted to verify the following: correct patient identity, procedure to be performed and as applicable, correct side and site, correct patient position, and availability of implants, special equipment, or special requirements.
0	 Patient was instructed to inform nursing staff of changes in medical status or mood, patient verbalized understanding.
0	 Identified Injury as a learning need, Patients primary language is English, No Barriers to learning were identified, No interventions were used to address Barriers to Learning, Teaching methods used included Printed Patient Instructions, Verbal Instructions, Patient verbalized an understanding of discharge teaching.
0	 Gait steady, History obtained from patient, Patient cooperative, alert, Oriented to person, place and time.
0	He will let me know if he changes his mind.
1	 Cyanocobalamin [VITAMIN B12] 1,000 mcg/mL solution 1,000 micrograms intramuscular as directed by prescriber.
0	 Patient will demonstrate and/or verbalize understanding of home exercise program in 6 sessions for improved self management of the condition.
1	Ativan 0.5 mg tablet 1 tablet by mouth as directed by prescriber as needed.
0	 Identified Injury as a learning need, No Barriers to learning were identified, No interventions were used to address Barriers to Learning, Teaching methods used included Printed Patient Instructions, Verbal Instructions, Patient verbalized an understanding of discharge teaching.
0	 Discussed the risks, goals, alternatives, and the necessity of other members of the healthcare team participating in the procedure.
0	 No: new shortness of breath at rest; pain, pressure or tightness unrelated to coughing in chest, jaw, or arm.
1	fluconazole [DIFLUCAN] 150 mg tablet 1 tablet by mouth as directed by prescriber.
0	Please let us know if you have further questions/concerns.
0	I have reviewed the above documentation and agree or amended.
0	 No: currently inconsolable; vomiting; diarrhea; not eating normally; poor weight gain or jaundice
0	 I instructed the patient on the importance of maintaining a diet constant in vitamin K, maintaining a similar diet during vacation, maintaining blood pressure under control, reporting any nausea with vomiting/diarrhea, reporting viral/bacterial infections, reporting any change in over-the-counter or prescription medicines, avoiding alcoholic beverages, reporting dental/surgical procedures/endoscopies at least 10 days ahead of time, and promptly reporting any plan to stop or start using tobacco in any form.. The patient also understands that he/she should quickly get to the emergency department should symptoms suggesting bleeding, TIA/stroke, pulmonary embolus, or venous thromboembolism occur.
0	 Instructions: Apply 1 patch every 24 hours; leave on for up to 12 hours within a 24 hour period; to feet for neuropathy.
0	 Patient discharged to home, ambulating without assistance, family driving, accompanied by husband/wife/partner, Discharge instructions given to patient, Simple or moderate discharge teaching performed, Above person(s) verbalized understanding of discharge instructions and follow-up care.
0	 Patient seen and discussed with supervising consultant, Dr. W who evaluated the patient and concurs with the assessment and plan.
1	fenofibrate nanocrystallized [TRICOR] 145 mg tablet 1 tablet by mouth one time daily.
0	I have seen the patient and reviewed the NST and I interpret the tracing as reactive with a baseline of 135.
0	Patient was in agreement with plan going forward.
0	 Eye: pupils dilated; background retinopathy - unknown right and left; macular edema - unknown right and left.
1	Allegra 180 mg tablet 1 tablet by mouth one time daily as needed.
0	 No: new confusion or inability to stay alert and awake or currently feeling like she is going to collapse every time she stands or sits up
0	 No: new confusion or inability to stay alert and awake; new shortness of breath; new wheezing or chest tightness or raised, red or white, itchy rash that comes and goes (hives)
0	 The patient was instructed to contact me with regard to any questions pertaining to the procedure, as needed.
0	 Respiratory assessment findings include respiratory effort easy, Respirations regular, Conversing normally, no signs of distress, no retractions noted.
0	No: fever each day for more than 72 hours; fever that has recurred after 24 hours without fever or temperature of 103?F ( 39.4?C) or greater (in an adult)
1	Patient is here for the following immunization(s):  Tetanus and Diphtheria and Acellular Pertussis (Tdap) Vaccine
0	 GI: Denies decreased appetite, nausea, vomiting, diarrhea, constipation, hematemesis, hematochezia, melena, abdominal pain.
0	 Identified Illness as a learning need, Patients primary language is English, No Barriers to learning were identified, No interventions were used to address Barriers to Learning, Teaching methods used included Printed Patient Instructions, Verbal Instructions, Patient verbalized an understanding of discharge teaching.
0	She was admitted on the day of surgery and taken to the operating room for the planned procedure.
0	Negative for difficulty urinating, pain with urination and frequent urination.
0	 Patient discharged to home, ambulating without assistance, family driving, Discharge instructions given to patient, Above person(s) verbalized understanding of discharge instructions and follow-up care.
1	 Maxair Autohaler 200 mcg/Inhalation Aerosol 2-4 puffs by inhalation every 4 hours as needed.
0	 Pain or pressure in cheeks or forehead over sinuses, or in the upper jaw, green or yellow colored nasal discharge and pain in the face or upper jaw that is worse on bending forward
0	 Patient requires supervision only in the following activities:  dressing, grooming/hygiene, toileting, transfer to/from bed/chair, mobility.
0	 The parent was instructed to notify the clinic if there is no improvement within 72 hours, that the patient is contagious until they have been on medication for 24 hours, of the importance of completing all of the medication.
1	Dyazide 37.5-25 mg capsule 1 capsule by mouth one time daily.
0	 Consent comment:  Discussed the risks, benefits, alternatives, and the necessity of other members of the healthcare team participating in the procedure.
0	 PAIN SCALE: The Numeric pain scale was used to identify client's level of pain (0= no pain and 10 = worst possible pain): 7.
0	 You may need to return here or go to the nearest Emergency Department if you develop more symptoms that might mean you are having complications from your bleeding.
0	The patient was attentive to the interactions of other group members and displayed congruent body language.
0	 Respiratory assessment findings include respiratory effort easy, Respirations regular, Conversing normally, no signs of distress, no cyanosis.
0	 The patient/caregiver was encouraged to report any questions, concerns, new or worsening symptoms.
0	 Identified Illness as a learning need, No Barriers to learning were identified, Teaching methods used included Printed Patient Instructions, Verbal Instructions, Patient verbalized an understanding of discharge teaching.
0	 The risks and benefits of the procedure were discussed, and the patient consented to this procedure.
0	The patient stated understanding and desired to proceed.
0	At the end of the massage, the patient may apply lotion or vitamin E oil to the skin.
1	ferrous sulfate 325 mg (65 mg iron) tablet 1 tablet by mouth one time daily.
0	The distal circulation, sensation, and motor function is intact.
1	diltiazem [CARDIZEM CD] 360 mg capsule sustained release 24 hour 1 capsule by mouth one time daily.
0	The patient reports agreement with the plan, with no further questions at this time.
0	 Patient education: Ready to learn, no apparent learning barriers were identified; learning preferences include listening.
0	 Strep screen, treat per protocol, symptomatic relief discussed, Advised to recheck if not resolved in one week or sooner if worse in any way.
0	 Identified Illness as a learning need, Teaching methods used included Printed Patient Instructions, Verbal Instructions.
1	Premarin 0.625 mg/gram cream 1 gram vaginally as directed by prescriber.
0	 No: new confusion or inability to stay alert and awake; new shortness of breath; new wheezing or chest tightness; sudden swelling of the lips, tongue or mouth; sudden severe swelling of the eyelids; difficulty swallowing that came on suddenly or purple or red rash/blotches that stay when pressed by a glass (purpuric rash)
0	Cognitive and/or language difficulties or the patient's age prevented the patient from understanding the diagnosis and/or treatment plan.
0	F (38 C) or suspected fever; pain in the side of the back below the ribs (flank pain) or nausea or vomiting present
1	Tylenol Extra Strength 500 mg tablet 2 tablets by mouth as needed.
0	 Sudden onset of symptoms, Date and time of onset was 1 hour ago, There has been no change in the patient's symptoms over time, are constant.
0	 Patient arrives, via hospital wheelchair, Gait steady, History obtained from patient, Patient appears, anxious, uncomfortable, Patient cooperative, alert, Oriented to person, place and time.
1	levothyroxine [SYNTHROID] 25 mcg tablet 1 tablet by mouth one time daily.
0	 If the patient experiences any of these possible signs and symptoms of a DVT or PE, report to the local emergency room immediately.
0	 Discussed risks, goals, alternatives, advance directives, and the necessity of other members of the healthcare team participating in the procedure with the patient .
0	 Patient discharged to home, carried, family driving, accompanied by parent, Above person(s) verbalized understanding of discharge instructions and follow-up care.
0	 Respiratory assessment findings include respiratory effort, tachypneic, Respirations regular, Conversing normally, no signs of distress.
0	Individual is able to understand limited conversations about routine daily activities with familiar communication partners.
0	Eyes:  Pupils are approximately 3 mm and symmetric.
1	torsemide [DEMADEX] 10 mg tablet 1 tablet by mouth one time daily.
1	pantoprazole [PROTONIX] 40 mg tablet enteric coated 1 tablet by mouth twice daily before meals.
1	oxybutynin [DITROPAN] 5 mg tablet 1 tablet by mouth two times a day.
0	 No: new confusion or inability to stay alert and awake; currently feeling like you are going to collapse every time you stand (sit); newly stiff or painful neck; purple or red rash/blotches that stay when pressed by a glass (purpural rash) or pain, pressure or tightness in the chest, jaw or arm
0	Goals were typed and printed for the patient.
0	 No: new confusion or inability to stay alert and awake; currently struggling to breathe, even while inactive or resting; any chest pain or discomfort; currently feeling like you are going to collapse every time you stand (sit); vomiting blood or uncontrollable or continuous rectal bleeding
0	 Patient participated in weekend planning group engaging in structuring and organizing time to promote a balance of activity between work, home activities and self-cares as well as other program concepts.
0	 Side rails up, Cart/Stretcher in lowest position, Call light within reach, Hospital ID band on, Patient in view of the nursing station, safety, dignity, sense of well being and individual rights are respected.
0	 No: heart problems; asthma or chronic bronchitis, chronic obstructive pulmonary disease (COPD) or emphysema
0	 Risks, potential complications, prognosis, and postoperative rehabilitation program were outlined in detail; all questions answered.
0	 Informed consent: Discussed risks, goals, alternatives, and the necessity of other members of the healthcare team participating in the procedure with the patient and obtained informed consent.
0	 Complex assessment performed, Patient arrives, via stretcher, via Emergency Medical Services, Unsteady gait, Assistance to cart, History obtained from patient, Patient appears comfortable, Patient cooperative, alert, Oriented to person, place and time.
0	 No: new confusion or inability to stay alert and awake; currently feeling like you are going to collapse every time you stand (sit); purple or red rash/blotches that stay when pressed by a glass (purpural rash) or newly painful neck with difficulty bending the neck
0	Thank you for choosing the Name, M.D.. care team for your health care needs!
0	 Patient was provided with written patient education materials and she relates a good understanding of the self-management program.
0	 Identified Illness as a learning need, Identified Follow-up care as a learning need, Identified Medications as a learning need, Patients primary language is English, No Barriers to learning were identified, No interventions were used to address Barriers to Learning, Teaching methods used included Printed Patient Instructions.
1	 Disp : 100 - TAB, Directions : ONE DAILY, Refill : 3 Time(s), Expire Rx on : 1 YR, Route : ORAL
1	 Spiriva with HandiHaler 18 mcg Capsule, w/Inhalation Device 1 capsule by inhalation as directed by prescriber re...
1	ondansetron [ZOFRAN ODT] 4 mg tablet Rapid Dissolve 1 tablet by mouth every 6 hours as needed.
1	spironolacton-HCTZ [ALDACTAZIDE] 25-25 mg tablet 1 tablet by mouth one time daily.
1	fluconazole [DIFLUCAN] 150 mg tablet 1 tablet by mouth as directed by prescriber.
0	 Since his last contact,  the participant has not had prostate-related treatments or procedures Since his last contact the participant has not used finasteride.
0	 MEDICAL NECESSITY: The patient would benefit from skilled physical therapy interventions to be able to return the patient to full work, home, leisure activities.
0	No difficulty with active range of motion of the upper and lower extremities.
0	 Strep screen, treat regardless of throat culture results, symptomatic relief discussed, Strep pharyngitis considered contagiousness until treated for 24 hours, Advised to recheck if not resolved in one week or sooner if worse in any way., Medications and side effects discussed.
0	 No: fever each day for more than 72 hours; fever that has recurred after 24 hours without fever or recurrent, unexplained fevers over several weeks
0	 No: currently inconsolable crying; vomiting; not feeding normally; fever (rectal temperature) of more than 100.4
0	The client verbalized understanding and consented to the plan of care.
1	Senna-Docusate Sodium [SENOKOT S] 8.6-50 mg tablet 2 tablets by mouth one time daily.
0	The patient has crutches and instructions were given to bring them with to the hospital.
0	 Negative genitourinary review of systems, Historian denies dysuria, dysuria, frequency, hematuria.
0	 Neurologic: No fainting, blackouts, seizures, weakness, paralysis, tingling, numbness, tremors, involuntary movements.
0	 We discussed advance directives and the necessity of other members of the healthcare team participating in the procedure.
1	metformin 500 mg tablet 2 tablets by mouth two times a day.
0	 Identified Illness as a learning need, No Barriers to learning were identified, Teaching methods used included Printed Patient Instructions.
0	Negative for abdominal pain, diarrhea, nausea and vomiting.
1	ketoprofen 75 mg capsule 1 capsule by mouth two times a day as needed.
0	 A copy of the form was given to the participant and a copy will be filed in the Mayo Medical Record.
0	Patient was not seen and information was gathered by the care coordinator.
0	 Patient arrives, via hospital wheelchair, History obtained from patient, Patient appears comfortable, Patient cooperative, alert, Oriented to person, place and time.
0	 Discussed the risks, goals, alternatives, and advanced directives and the necessity of other members of the healthcare team participating in the procedure with the patient (or legal representative and other present during the discussion).
0	Allergies, Medications, Past Medical and Surgical History:     Allergies reviewed and updated as necessary.
0	 I discussed the necessity of other members of the surgical team participating in the interventional procedure.
0	The Traumatic Brain Injury physician discussed with the patient verbal and written information on TBI.
1	Iron (ferrous sulfate) 325 mg (65 mg iron) tablet 1 tablet by mouth one time daily.
0	 Patient discharged to home, in a wheelchair, family driving, accompanied by other family member, Above person(s) verbalized understanding of discharge instructions and follow-up care.
0	The patient was prepped and draped in the usual sterile fashion.
0	 No: new confusion or inability to stay alert and awake; feeling like you are going to pass out EVERY time you stand (or sit) up; blue or dusky lips, skin or nail beds; purple or red rash/blotches that stay when pressed by a glass (purpural rash); newly stiff or painful neck or puffiness around the eyes
0	The following portions of the patient's history were reviewed and updated as appropriate: current medications, medical history and problem list.
0	 Respiratory assessment findings include respiratory effort easy, Respirations regular, Conversing normally, no signs of distress, no retractions noted, no cyanosis, no associated cough noted.
0	 PATIENT EDUCATION:  Ready to learn, no apparent learning barriers were identified; learning preferences include listening.
0	Explained diagnosis and treatment plan: patient/caregiver expressed understanding of the content.
0	Discussed advanced directives and the necessity of other members of the healthcare team participating in the procedure.
0	 Current exercise program:  Reviewed and modified patient's home exercise program to include:
0	 The patient was instructed to contact me with regard to any questions pertaining to the injection and to inform me of the results in a period of approximately two weeks.
1	B Complex Vitamin tablet 1 tablet by mouth one time daily.
0	The patient was encouraged to contact myself or the consultant if any questions or concerns come up after our visit.
0	Explained diagnosis and treatment plan; patient/parents expressed understanding of the content.
0	 I began my consultation with the patient by reviewing the reason for the medical genetics consultation today.
0	 The patient is able to name her medical conditions and associated symptoms for the condition she was hospitalized for and have a clear understanding of these.
0	No questions or concerns at conclusion of treatment.
1	-- Colace 100 mg tablet, take one tablet twice daily as needed to keep stools soft.
0	 Patient discharged to home, carried, accompanied by parent, Discharge instructions given to mother.
0	Patient voiced understanding and agreement or concern about medication adjustments.
0	The patient was felt to be stable for dismissal.
0	They are dystrophic without irritation or break in the skin.
0	 Patient requires extensive assistance in the following activities:  toileting, transfer to/from bed/chair, mobility.
0	 Discussed risks, goals, alternatives, advanced directives and complications with the patient as well as necessity of other members of the surgical team participating in the interventional procedure.
0	 Goal level:  LEVEL 4: The individual is successfully able to initiate communication using spoken language in simple, structured conversations in routine daily activities with familiar communication partners.
0	 No: new confusion or inability to stay alert and awake; struggling to breathe even while inactive or resting; currently feeling like you are going to collapse every time you stand or sit up; vomit that looks like ground coffee; vomiting blood; uncontrollable or continuous rectal bleeding; black, sticky, tar-like stools; heavy vaginal bleeding or purple or red rash/blotches that stay when pressed by a glass (purpuric rash)
0	 No: fever present (greater than or equal to 100.4 F or 38 C) or suspected fever; headache; very itchy eyes, nose, roof of mouth, or throat; hoarseness or lost voice; bad breath or ear pain
0	 No: localized area of red, swollen, tender and warm skin that is expanding; red streaks going out from the localized area of redness or pus discharge
0	Genitourinary:  Negative for difficulty urinating and frequent urination.
0	 Negative constitutional review of systems, Historian denies chills, fatigue, fever, weakness, weight loss.
0	 Patient is here for the following immunization(s):  Inactivated Influenza Virus Vaccination; Hepatitis B Vaccine
0	Patient is here for the following immunization(s):  Inactivated Influenza Virus Vaccination; Pneumococcal Polysaccharide 23 Vaccine (PPV23)
0	 Patient Education: I found the patient to be ready to learn, no apparent learning barriers were identified; learning preferences include listening.
1	Albuterol Aerosol 90 mcg/Actuation 2 puffs by inhalation as directed by prescriber as needed.
0	 No: new confusion or inability to stay alert and awake; noisy, wheezy or raspy breathing that does not clear with coughing; newly stiff or painful neck; purple or red rash/blotches that stay when pressed by a glass (purpural rash); currently feeling like you are going to collapse every time you stand (sit); muffled voice or inability to open mouth fully or complete inability to swallow
0	 No apparent learning barriers were identified; learning preferences include: reading, listening
1	prednisone 20 mg tablet 3 tablets by mouth one time daily.
0	 Pain or pressure in cheeks or forehead over sinuses, or in the upper jaw and discolored nasal or postnasal discharge
0	 Assessment of Impairment, Severity/Complexity of Illness: The degree of impairment is exemplified by negative influence from living with chronic pain.
0	 Patient arrives, via hospital wheelchair, Patient cooperative, alert, Oriented to person, place and time.
0	 The patient was provided the Patient Bill of Rights and had no questions about them at this time.
0	 Parent ready to learn, no apparent learning barriers were identified; learning preferences include delineated.
0	 Patients primary language is English, Teaching methods used included Printed Patient Instructions, Verbal Instructions, Patient verbalized an understanding of discharge teaching.
0	Explained diagnosis and treatment plan; patient/child/care giver expressed understanding of the content and agreement with the plan of care.
0	 Identified Illness as a learning need, Identified Follow-up care as a learning need, Patients primary language is English, No Barriers to learning were identified, Teaching methods used included Verbal Instructions.
1	 Disp : 30 - TAB, Directions : ONE OR TWO Q4-6H PRN PAIN; DO NOT EXCEED 8/DAY, Refill : None, Expire Rx on : None, Route : ORAL
0	 The patient has not experienced TIA symptoms, facial drooping, left leg/calf pain, right leg/calf pain, dyspnea, prolonged bleeding, blood in stool or urine, nose bleeds, easy bruising, changes in prescription medicines, changes in over-the-counter medicines, recent injury/fall(s), blood pressure elevations above 140/90.
0	 Peripheral IV site, established in the right antecubital, using an 18 gauge catheter, in one attempt.
0	 Patient requires extensive assistance in the following activities:  toileting, transfer to/from bed/chair, mobility.
0	The patient was placed into Trendelenburg position with the right side tilted up.
0	 Cardiovascular assessment findings include heart rate normal, Heart rhythm normal sinus, No associated diaphoresis.
0	 The plan of care, as outlined above, will be communicated to the patient and reviewed with patient at nurse visit.
0	 Negative gastrointestinal review of systems, Historian denies abdominal pain, hematemesis, hematochezia, jaundice, melena, vomiting.
0	 Discussed risks and benefits of an unsedated bone marrow, the potential need for repeating the procedure and the necessity of other members of the healthcare team participating in the procedure with the patient.
0	 The patient offers verbalizations that indicate emotional and cognitive understanding of problems related to alcohol use and describes needed behavior change.
0	 No: currently struggling to breathe, even while inactive or resting; currently feeling faint or passing out or new confusion or inability to stay alert and awake
